0,H-E-B Select Ingredients Lightly Salted Deluxe Mixed Nuts,3,tbsp,28,0,180,5,0,0,0,0,0,0,0,0,0,0,0,0,0,15,2,9,3.5,0,0,6,2,1,0,0,0,40,1.08,60,150,0,50,1.2,0.4,0.6,0,0,0,0,0,0.4,0,0,0,0,0,0,2.7,0,H-E-B,5.78,9,Dried Fruits and Nuts
1,Sabritas Japanese Style Peanuts,3,tbsp,30,0,160,5,0,0,0,0,0,0,0,0,0,0,0,0,0,9,1.5,0,0,0,0,15,2,4,0,0,0,0,0.36,0,0,0,150,0,0,0,0,0,0,0,0,0,0,0,0,0,0,0,0,0,H-E-B,1.99,7,Dried Fruits and Nuts
2,Ocean Spray Craisins Reduced Sugar Sweetened Dried Cranberries,0.25,cup,40,0,100,0,0,0,0,0,0,0,0,0,0,0,0,0,0,0,0,0,0,0,0,31,10,14,0,0,0,0,0,0,0,0,0,0,0,0,0,0,0,0,0,0,0,0,0,0,0,0,0,0,H-E-B,1.94,3,Dried Fruits and Nuts
3,Bulk Ellis Pecan Fancy Pecan Halves,0,,0,0,0,0,0,0,0,0,0,0,0,0,0,0,0,0,0,0,0,0,0,0,0,0,0,0,0,0,0,0,0,0,0,0,0,0,0,0,0,0,0,0,0,0,0,0,0,0,0,0,0,0,H-E-B,11.99,0,Dried Fruits and Nuts
4,H-E-B Select Ingredients California Sweet Raisins Mini Boxes,3,boxes,43,0,130,1,0,0,0,0,0,0,0,0,0,0,0,0,0,0,0,0,0,0,0,34,2,25,0,0,0,20,0.72,0,0,320,0,0,0,0,0,0,0,0,0,0,0,0,0,0,1.2,0,0,0,H-E-B,2,4.5,Dried Fruits and Nuts
5,H-E-B Roasted and Salted Peanuts,0.25,cup,28,0,160,7,0,0,0,0,0,0,0,0,0,0,0,0,0,14,2,7,4.5,0,0,5,2,1,0,0,0,20,0.36,60,150,190,110,1.5,0.4,0.6,0,0,0,0,0,4,0,0,0,0,0,0,0,0,H-E-B,2.58,12,Dried Fruits and Nuts
6,H-E-B Dried Fruit Jumbo Raisin Medley,0.25,cup,40,0,130,1,0,0,0,0,0,0,0,0,0,0,0,0,0,0,0,0,0,0,0,31,2,29,0,0,0,20,1.08,0,0,0,10,0,0,0,0,0,0,0,0,0,0,0,0,0,0,0,0,0,H-E-B,3.24,9,Dried Fruits and Nuts
7,Sabritas Mexican Style Mix Peanuts,3,tbsp,30,0,200,17,0,0,0,0,0,0,0,0,0,0,0,0,0,17,3,0,0,0,0,5,4,1,0,0,0,0,0.36,0,0,0,135,0,0,0,0,0,0,0,0,0,0,0,0,0,0,0,0,0,H-E-B,1.99,7,Dried Fruits and Nuts
8,SunRidge Farms Turkish Apricots - Unsulphured,0,,0,0,0,0,0,0,0,0,0,0,0,0,0,0,0,0,0,0,0,0,0,0,0,0,0,0,0,0,0,0,0,0,0,0,0,0,0,0,0,0,0,0,0,0,0,0,0,0,0,0,0,0,H-E-B,7.99,0,Dried Fruits and Nuts
9,SunRidge Farms Cranberry Fiesta Mix,0,,0,0,0,0,0,0,0,0,0,0,0,0,0,0,0,0,0,0,0,0,0,0,0,0,0,0,0,0,0,0,0,0,0,0,0,0,0,0,0,0,0,0,0,0,0,0,0,0,0,0,0,0,H-E-B,5.49,0,Dried Fruits and Nuts
10,SunRidge Farms Cashews - Whole Raw,0,,0,0,0,0,0,0,0,0,0,0,0,0,0,0,0,0,0,0,0,0,0,0,0,0,0,0,0,0,0,0,0,0,0,0,0,0,0,0,0,0,0,0,0,0,0,0,0,0,0,0,0,0,H-E-B,10.49,0,Dried Fruits and Nuts
11,Nutty And Fruity Ginger Chunks,0,,0,0,0,0,0,0,0,0,0,0,0,0,0,0,0,0,0,0,0,0,0,0,0,0,0,0,0,0,0,0,0,0,0,0,0,0,0,0,0,0,0,0,0,0,0,0,0,0,0,0,0,0,H-E-B,3.99,0,Dried Fruits and Nuts
12,H-E-B Organics Raw Sunflower Seeds  Unsalted,0.25,cups,30,0,170,7,0,0,0,0,0,0,0,0,0,0,0,0,0,15,1.5,0,0,0,0,6,3,1,0,0,0,40,1.8,0,0,0,0,0,0,0,0,0,0,0,0,0,0,0,0,0,0,0,0,0,H-E-B,2.77,9,Dried Fruits and Nuts
13,Picosos Hot Chili Peanuts,0,,0,0,0,0,0,0,0,0,0,0,0,0,0,0,0,0,0,0,0,0,0,0,0,0,0,0,0,0,0,0,0,0,0,0,0,0,0,0,0,0,0,0,0,0,0,0,0,0,0,0,0,0,H-E-B,3.36,0,Dried Fruits and Nuts
14,SunRidge Farms Organic Dried Goji Berries,0,,0,0,0,0,0,0,0,0,0,0,0,0,0,0,0,0,0,0,0,0,0,0,0,0,0,0,0,0,0,0,0,0,0,0,0,0,0,0,0,0,0,0,0,0,0,0,0,0,0,0,0,0,H-E-B,21.99,0,Dried Fruits and Nuts
15,Sun-Maid California Mission Figs,0.25,cup,40,0,110,1,0,0,0,0,0,0,0,0,0,0,0,0,0,0,0,0,0,0,0,26,5,20,0,0,0,60,1.08,24,0,240,0,0,0.16,0,0,0,0,0,0,0,0,0,0,0,0,0,0,0,H-E-B,3.48,4,Dried Fruits and Nuts
16,Blue Diamond Toasted Coconut Oven Roasted Almonds,1,oz,28,0,160,6,0,0,0,0,0,0,0,0,0,0,0,0,0,14,1,0,0,0,0,7,3,3,0,0,0,60,1.08,80,0,190,35,0,0,0,0,0,0,0,0,0,0,0,0,0,0,0,9.45,0,H-E-B,7.96,14,Dried Fruits and Nuts
17,Lone Star Nut &amp; Candy Diet Delight Mix,0,,0,0,0,0,0,0,0,0,0,0,0,0,0,0,0,0,0,0,0,0,0,0,0,0,0,0,0,0,0,0,0,0,0,0,0,0,0,0,0,0,0,0,0,0,0,0,0,0,0,0,0,0,H-E-B,4.39,0,Dried Fruits and Nuts
18,Planters Salted Caramel Peanuts,1,oz,28,0,160,6,0,0,0,0,0,0,0,0,0,0,0,0,0,12,1.5,6,4,0,0,9,2,5,0,0,0,20,1.08,40,80,170,95,0,0,0.5,0,0,0,0,0,3,0,0,0,0,0,0,2.7,0,H-E-B,1.48,6,Dried Fruits and Nuts
19,AustiNuts Salted Mixed Nuts,1,oz,28,0,160,6,0,0,0,0,0,0,0,0,0,0,0,0,0,14,2,0,0,0,0,6,2,1,0,0,0,30,1.44,0,0,0,215,0,0,0,0,0,0,0,0,0,0,0,0,0,0,0,0,0,H-E-B,2.99,7,Dried Fruits and Nuts
20,Ocean Spray Craisins Original Dried Cranberries,0.333,cup,40,0,130,0,0,0,0,0,0,0,0,0,0,0,0,0,0,0,0,0,0,0,0,33,3,26,0,0,0,0,0,0,0,0,0,0,0,0,0,0,0,0,0,0,0,0,0,0,0,0,0,0,H-E-B,2.98,8,Dried Fruits and Nuts
21,H-E-B Berry Orchard Trail Mix,0.25,cup,32,0,140,3,0,0,0,0,0,0,0,0,0,0,0,0,0,6,0.5,2,3,0,0,19,2,13,0,0,0,40,0.72,0,0,160,0,0,0,0,0,0,100,0,0,0,0,0,0,0,0,0,2.7,0,H-E-B,8.98,21,Dried Fruits and Nuts
22,Woodstock Farms Organic Tequila Lime Sunflower Seeds,0,,0,0,0,0,0,0,0,0,0,0,0,0,0,0,0,0,0,0,0,0,0,0,0,0,0,0,0,0,0,0,0,0,0,0,0,0,0,0,0,0,0,0,0,0,0,0,0,0,0,0,0,0,H-E-B,6.49,0,Dried Fruits and Nuts
23,Jordan Almonds Pre-packed Hatch Green Chili Cashews,0,,0,0,0,0,0,0,0,0,0,0,0,0,0,0,0,0,0,0,0,0,0,0,0,0,0,0,0,0,0,0,0,0,0,0,0,0,0,0,0,0,0,0,0,0,0,0,0,0,0,0,0,0,H-E-B,4.99,0,Dried Fruits and Nuts
24,Nut Harvest Honey Roasted Mixed Nuts,1,oz,28,0,170,5,0,0,0,0,0,0,0,0,0,0,0,0,0,13,2.5,0,0,0,0,9,3,4,0,0,0,40,0.72,0,0,0,115,0,0,0,0,0,0,0,0,0,0,0,0,0,0,0,0,0,H-E-B,1.99,3,Dried Fruits and Nuts
25,Blue Diamond Almonds Sweet Thai Chili,0,,0,0,0,0,0,0,0,0,0,0,0,0,0,0,0,0,0,0,0,0,0,0,0,0,0,0,0,0,0,0,0,0,0,0,0,0,0,0,0,0,0,0,0,0,0,0,0,0,0,0,0,0,H-E-B,3.44,0,Dried Fruits and Nuts
26,Planters Redskin Spanish Peanuts,1,oz,28,0,170,7,0,0,0,0,0,0,0,0,0,0,0,0,0,15,2.5,7,5,0,0,4,3,1,0,0,0,20,1.08,60,100,210,115,0.9,0.3,0.7,0,0,0,0,0,4,0,0,0,0,0,0,2.7,0,H-E-B,3.18,1,Dried Fruits and Nuts
27,Planters Nut-rition Heart Healthy Mix,1,oz,28,0,170,6,0,0,0,0,0,0,0,0,0,0,0,0,0,15,1.5,8,4.5,0,0,5,3,1,0,0,0,40,1.08,60,100,200,35,0,0.3,0.7,0,0,0,0,0,2,0,0,0,0,0,0,5.4,0,H-E-B,5.86,10,Dried Fruits and Nuts
28,Jubes Nata De Coco Pandan Flavor,0,,0,0,0,0,0,0,0,0,0,0,0,0,0,0,0,0,0,0,0,0,0,0,0,0,0,0,0,0,0,0,0,0,0,0,0,0,0,0,0,0,0,0,0,0,0,0,0,0,0,0,0,0,H-E-B,1.49,0,Dried Fruits and Nuts
29,H-E-B Organics Cranberry Walnut Clusters,0.25,cups,30,0,130,3,0,0,0,0,0,0,0,0,0,0,0,0,0,5,1,0,0,0,0,16,2,12,0,0,0,20,1.44,0,0,0,15,0,0,0,0,0,0,0,0,0,0,0,0,0,0,0,0,0,H-E-B,3.97,8,Dried Fruits and Nuts
30,Nature's Eats Hatch Cashews,0,,0,0,0,0,0,0,0,0,0,0,0,0,0,0,0,0,0,0,0,0,0,0,0,0,0,0,0,0,0,0,0,0,0,0,0,0,0,0,0,0,0,0,0,0,0,0,0,0,0,0,0,0,H-E-B,2.98,0,Nuts
31,Blue Diamond Smokehouse Almonds,28,nuts,28,0,170,6,0,0,0,0,0,0,0,0,0,0,0,0,0,16,1,0,0,0,0,5,3,1,0,0,0,80,1.08,80,0,190,150,0,0,0,0,0,0,0,0,0,0,0,0,0,0,0,9.45,0,H-E-B,3.44,6,Dried Fruits and Nuts
32,Sun-Maid Natural California Zante Currants,0.25,cup,40,0,130,1,0,0,0,0,0,0,0,0,0,0,0,0,0,0,0,0,0,0,0,31,2,28,0,0,0,20,0.72,0,0,290,5,0,0,0,0,0,0,0,0,0,0,0,0,0,0,0,0,0,H-E-B,3.48,7,Dried Fruits and Nuts
33,H-E-B Select Ingredients Milk Chocolate Turbinado And Cinnamon Pecans,0.25,cup,30,0,170,0,0,0,0,0,0,0,0,0,0,0,0,0,0,0,0,0,0,0,0,0,0,0,0,0,0,330,0.18,0,0,0,0,0,0,0,0,0,0,0,0,0,0,0,0,0,0,0,0,0,H-E-B,3.98,2,Dried Fruits and Nuts
34,Stretch Island Fruit Co. Abundant Apricot Fruit Strip,1,strip,14,0,45,0,0,0,0,0,0,0,0,0,0,0,0,0,0,0,0,0,0,0,0,11,1,8,0,0,0,0,0,0,0,130,0,0,0,0,0,0,0,0,0,0,0,0,0,0,0,0,0,0,H-E-B,0.49,1,Dried Fruits and Nuts
35,H-E-B Select Ingredients City Street Nuts Austin Style Pecans,17,pieces,30,0,210,3,0,0,0,0,0,0,0,0,0,0,0,0,0,21,2,0,0,0,0,4,3,1,0,0,0,20,0.72,0,0,120,310,0,0,0,0,0,0,0,0,0,0,0,0,0,0,0,0,0,H-E-B,4.98,7,Dried Fruits and Nuts
36,Planters Lightly Salted Halves And Pieces Cashews,50,pieces,28,0,160,5,0,0,0,0,0,0,0,0,0,0,0,0,0,13,2.5,7,2.5,0,0,9,1,2,0,0,0,0,1.8,80,150,190,45,1.5,0.6,0.5,0,0,0,0,0,0,0,0,0,0,0,0,0,0,H-E-B,5.88,8,Dried Fruits and Nuts
37,Emerald 100 Calorie Packs Dry Roasted Almonds,1,package,18,0,100,4,0,0,0,0,0,0,0,0,0,0,0,0,0,9,0.5,6,2,0,0,4,2,1,0,0,0,40,0.72,0,0,125,150,0,0,0,0,0,0,0,0,0,0,0,0,0,0,0,5.4,0,H-E-B,3.44,7,Dried Fruits and Nuts
38,H-E-B Organics Dark Chocolate Raisins,0.25,cups,40,0,160,2,0,0,0,0,0,0,0,0,0,0,0,0,0,6,4,0,0,0,0,29,2,23,0,0,0,20,1.08,0,0,0,0,0,0,0,0,0,0,0,0,0,0,0,0,0,0,0,0,0,H-E-B,5.87,9,Candy
39,H-E-B Milk Chocolate Raisins,34,pieces,40,0,170,2,0,0,0,0,0,0,0,0,0,0,0,0,0,8,4.5,0,0,0,5,27,1,23,0,0,0,40,0.72,0,0,0,15,0,0,0,0,0,0,0,0,0,0,0,0,0,1.2,0,0,0,H-E-B,8.99,16,Dried Fruits and Nuts
40,Falcon Trading Organic Blueberries,0,,0,0,0,0,0,0,0,0,0,0,0,0,0,0,0,0,0,0,0,0,0,0,0,0,0,0,0,0,0,0,0,0,0,0,0,0,0,0,0,0,0,0,0,0,0,0,0,0,0,0,0,0,H-E-B,21.99,0,Dried Fruits and Nuts
41,Planters Dry Roasted Pistachios,0.5,cup,28,0,160,6,0,0,0,0,0,0,0,0,0,0,0,0,0,13,1.5,7,4,0,0,8,3,2,0,0,0,20,1.08,0,100,280,150,0,0.4,0.3,0,0,0,0.225,0,0,0,0,0,0,0,0,0,0,H-E-B,7.98,7,Dried Fruits and Nuts
42,Lone Star Nut &amp; Candy Sliced Raw Natural Almonds,0,,0,0,0,0,0,0,0,0,0,0,0,0,0,0,0,0,0,0,0,0,0,0,0,0,0,0,0,0,0,0,0,0,0,0,0,0,0,0,0,0,0,0,0,0,0,0,0,0,0,0,0,0,H-E-B,10.99,0,Dried Fruits and Nuts
43,H-E-B Honey Roasted Mixed Nuts,0.25,cup,30,0,190,6,0,0,0,0,0,0,0,0,0,0,0,0,0,15,2,8,3.5,0,0,8,2,5,0,0,0,20,0.72,0,0,0,120,0,0,0,0,0,0,0,0,0,0,0,0,0,0,0,0,0,H-E-B,4.38,9,Dried Fruits and Nuts
44,H-E-B Trail Mix  Berry Orchard Multipack,1,package,50,0,220,4,0,0,0,0,0,0,0,0,0,0,0,0,0,12,1,4,6,0,0,28,4,19,0,0,0,60,1.08,0,0,230,0,0,0,0,0,0,100,0,0,0,0,0,0,0,0,0,0,0,H-E-B,6.98,8,Dried Fruits and Nuts
45,Paradise Old English Fruit And Peel Mix,2,tbsp,30,0,90,0,0,0,0,0,0,0,0,0,0,0,0,0,0,0,0,0,0,0,0,23,2,14,0,0,0,30,1.08,0,0,0,16,0,0,0,0,0,0,0,0,0,0,0,0,0,1.2,0,0,0,H-E-B,6.24,15,Dried Fruits and Nuts
46,Corn Nuts Ranch Flavored Crunchy Corn Kernels,0.33,cup,28,0,130,2,0,0,0,0,0,0,0,0,0,0,0,0,0,4.5,0.5,1.5,2,0,0,20,1,0,0,0,0,0,0.36,0,0,70,200,0,0,0,0,0,0,0,0,0,0,0,0,0,0,0,0,0,H-E-B,1.78,7,Dried Fruits and Nuts
47,AustiNuts Dry Roasted Salted Pumpkin Seeds,1,oz,28,0,125,5,0,0,0,0,0,0,0,0,0,0,0,0,0,5,1,0,0,0,0,15,0,0,0,0,0,20,1.08,0,0,0,160,0,0,0,0,0,0,0,0,0,0,0,0,0,0,0,0,0,H-E-B,4.49,8,Dried Fruits and Nuts
48,H-E-B Organics Dry Roasted Almonds  Unsalted,0.25,cups,30,0,190,7,0,0,0,0,0,0,0,0,0,0,0,0,0,16,1,0,0,0,0,6,3,1,0,0,0,80,1.44,0,0,0,0,0,0,0,0,0,0,0,0,0,0,0,0,0,0,0,0,0,H-E-B,7.97,9,Dried Fruits and Nuts
49,Winnuts Super Cantinero Snack Mix,0,,0,0,0,0,0,0,0,0,0,0,0,0,0,0,0,0,0,0,0,0,0,0,0,0,0,0,0,0,0,0,0,0,0,0,0,0,0,0,0,0,0,0,0,0,0,0,0,0,0,0,0,0,H-E-B,1.78,0,Dried Fruits and Nuts
50,Frito Lay Ranch Sunflower Seeds,0,,0,0,140,0,0,0,0,0,0,0,0,0,0,0,0,0,0,0,0,0,0,0,0,0,0,0,0,0,0,140,0.18,0,0,0,0,0,0,0,0,0,0,0,0,0,0,0,0,0,0,0,0,0,H-E-B,0.44,0,Dried Fruits and Nuts
51,H-E-B Select Ingredients Sweetened Dried Cranberries,0.25,cup,40,0,120,0,0,0,0,0,0,0,0,0,0,0,0,0,0,1,0,0,0,0,0,33,2,26,0,0,0,0,0.36,0,0,15,0,0,0,0,0,0,0,0,0,0,0,0,0,0,0,0,0,0,H-E-B,1.69,3.5,Dried Fruits and Nuts
52,H-E-B Select Ingredients Roasted &amp; Salted Pistachio Kernels,0.25,cup,28,0,170,7,0,0,0,0,0,0,0,0,0,0,0,0,0,14,1.5,0,0,0,0,7,3,2,0,0,0,20,1.08,0,100,270,160,0,0.3,0.3,0,0,0,0.15,0,0,0,0,0,0,0,0,0,0,H-E-B,5.98,6,Dried Fruits and Nuts
53,Second Nature Wholesome Medley,1,ounce,28,0,140,4,0,0,0,0,0,0,0,0,0,0,0,0,0,9,2,0,0,0,0,14,2,9,0,0,0,20,0.72,0,0,125,35,0,0,0,0,0,0,0,0,0,0,0,0,0,0,0,0,0,H-E-B,5.99,14,Dried Fruits and Nuts
54,Lone Star Nut &amp; Candy Raw Whole Cashews  sold by the,0,,0,0,0,0,0,0,0,0,0,0,0,0,0,0,0,0,0,0,0,0,0,0,0,0,0,0,0,0,0,0,0,0,0,0,0,0,0,0,0,0,0,0,0,0,0,0,0,0,0,0,0,0,H-E-B,6.98,0,Dried Fruits and Nuts
55,Just Tomatoes  Etc.! Fruit Munchies,0,,0,0,0,0,0,0,0,0,0,0,0,0,0,0,0,0,0,0,0,0,0,0,0,0,0,0,0,0,0,0,0,0,0,0,0,0,0,0,0,0,0,0,0,0,0,0,0,0,0,0,0,0,H-E-B,6.99,0,Dried Fruits and Nuts
56,SunRidge Farms Organic Banana Chips,0,,0,0,0,0,0,0,0,0,0,0,0,0,0,0,0,0,0,0,0,0,0,0,0,0,0,0,0,0,0,0,0,0,0,0,0,0,0,0,0,0,0,0,0,0,0,0,0,0,0,0,0,0,H-E-B,2.99,0,Dried Fruits and Nuts
57,Sun-Maid Dark Chocolate Yogurt Raisins,0.25,cup,30,0,120,1,0,0,0,0,0,0,0,0,0,0,0,0,0,4,3.5,0,0,0,0,21,2,16,0,0,0,20,1.08,0,0,190,15,0,0,0,0,0,0,0,0,0,0,0,0,0,0,0,0,0,H-E-B,3.37,7,Dried Fruits and Nuts
58,Mexsnax Chickpeas Garbanzos Con Chile Y Limon,0,,0,0,0,0,0,0,0,0,0,0,0,0,0,0,0,0,0,0,0,0,0,0,0,0,0,0,0,0,0,0,0,0,0,0,0,0,0,0,0,0,0,0,0,0,0,0,0,0,0,0,0,0,H-E-B,1.98,0,Dried Fruits and Nuts
59,SunRidge Farms Unsweetened Organic Mango Slices,0,,0,0,0,0,0,0,0,0,0,0,0,0,0,0,0,0,0,0,0,0,0,0,0,0,0,0,0,0,0,0,0,0,0,0,0,0,0,0,0,0,0,0,0,0,0,0,0,0,0,0,0,0,H-E-B,13.99,0,Dried Fruits and Nuts
60,Emerald Deluxe Mixed Nuts,1,oz,28,0,170,5,0,0,0,0,0,0,0,0,0,0,0,0,0,15,2,8,4,0,0,6,2,1,0,0,0,40,1.08,0,0,0,80,0,0,0,0,0,0,0,0,0,0,0,0,0,0,0,0,0,H-E-B,2.94,5,Dried Fruits and Nuts
61,Mariani Chopped Dates,0,,0,0,0,0,0,0,0,0,0,0,0,0,0,0,0,0,0,0,0,0,0,0,0,0,0,0,0,0,0,0,0,0,0,0,0,0,0,0,0,0,0,0,0,0,0,0,0,0,0,0,0,0,H-E-B,2.35,0,Dried Fruits and Nuts
62,Bare Simply Banana Chips,0,,0,0,0,0,0,0,0,0,0,0,0,0,0,0,0,0,0,0,0,0,0,0,0,0,0,0,0,0,0,0,0,0,0,0,0,0,0,0,0,0,0,0,0,0,0,0,0,0,0,0,0,0,H-E-B,3.79,0,Dried Fruits and Nuts
63,Brothers All Natural Banana Freeze-Dried Fruit Crisps,1,entire,17,0,66,1,0,0,0,0,0,0,0,0,0,0,0,0,0,0,0,0,0,0,0,16,2,8,0,0,0,100,0.36,0,0,0,0,0,0,0,0,0,150,0,0,0,0,0,0,0,0,0,0,0,H-E-B,0.88,1,Dried Fruits and Nuts
64,Samurai Hot Peanuts,0,,0,0,0,0,0,0,0,0,0,0,0,0,0,0,0,0,0,0,0,0,0,0,0,0,0,0,0,0,0,0,0,0,0,0,0,0,0,0,0,0,0,0,0,0,0,0,0,0,0,0,0,0,H-E-B,3,0,Dried Fruits and Nuts
65,Mariani Smoke Seasoned Almonds,0,,0,0,0,0,0,0,0,0,0,0,0,0,0,0,0,0,0,0,0,0,0,0,0,0,0,0,0,0,0,0,0,0,0,0,0,0,0,0,0,0,0,0,0,0,0,0,0,0,0,0,0,0,H-E-B,2.58,0,Dried Fruits and Nuts
66,Mariani Cherries,0.25,cup,40,0,0,1,0,0,0,0,0,0,0,0,0,0,0,0,0,0,0,0,0,0,0,33,1,27,0,0,0,20,0,16,20,210,0,0,0.2,0.04,0,0,1750,0,0.068,0.8,0,0,16,0,0,0,1.08,0,H-E-B,3.29,3.5,Dried Fruits and Nuts
67,H-E-B Praline Pecans,0.25,cup,32,0,200,3,0,0,0,0,0,0,0,0,0,0,0,0,0,15,1.5,8,5,0,0,13,1,6,0,0,0,20,0.72,0,0,0,120,0,0,0,0,0,0,0,0,0,0,0,0,0,0,0,0,0,H-E-B,5.38,8,Dried Fruits and Nuts
68,Hill Country Fare Hot Snack Mixes,0.25,cup,28,0,150,7,0,0,0,0,0,0,0,0,0,0,0,0,0,10,2,0,0,0,0,9,1,0,0,0,0,20,0.36,0,0,0,250,0,0,0,0,0,0,0,0,0,0,0,0,0,0,0,0,0,H-E-B,1.98,7,Dried Fruits and Nuts
69,Blue Diamond Almonds Smokehouse,1,package,43,0,260,9,0,0,0,0,0,0,0,0,0,0,0,0,0,23,2,0,0,0,0,7,4,2,0,0,0,100,1.44,100,0,280,230,0,0,0,0,0,0,0,0,0,0,0,0,0,0,0,13.5,0,H-E-B,1.28,0,Dried Fruits and Nuts
70,Planters Nut-rition Omega 3 Mix,0.25,cup,31,0,160,3,0,0,0,0,0,0,0,0,0,0,0,0,0,10,1.5,1.5,6,0,0,16,2,13,0,0,0,0,0.72,0,0,60,5,0,0.2,0.4,0,0,0,0,0,0,0,0,0,0,1.2,0,0,0,H-E-B,5.86,8,Dried Fruits and Nuts
71,H-E-B Select Ingredients Heart-E-Blend Trail Mix,0.25,cup,28,0,180,6,0,0,0,0,0,0,0,0,0,0,0,0,0,15,2,8,4.5,0,0,5,3,1,0,0,0,40,0.72,60,100,200,35,0.9,0.2,0.6,0,0,0,0,0,2,0,0,0,0,0,0,4.05,0,H-E-B,4.98,10,Dried Fruits and Nuts
72,Gourmet Nut Power Up Trail Mix Variety Pack,0,,0,0,0,0,0,0,0,0,0,0,0,0,0,0,0,0,0,0,0,0,0,0,0,0,0,0,0,0,0,0,0,0,0,0,0,0,0,0,0,0,0,0,0,0,0,0,0,0,0,0,0,0,H-E-B,8.98,0,Dried Fruits and Nuts
73,Bigs Tapatio Chile Limon Sunflower Seeds,0.75,cup,30,0,190,9,0,0,0,0,0,0,0,0,0,0,0,0,0,15,1.5,0,0,0,0,4,4,0,0,0,0,20,1.8,0,0,0,55,0,0,0,0,0,0,0,0,0,0,0,0,0,0,0,0,0,H-E-B,1.47,3,Dried Fruits and Nuts
74,True North Chocolate Nut Crunch,5,clusters,28,0,150,4,0,0,0,0,0,0,0,0,0,0,0,0,0,11,2,6,2,0,0,11,2,7,0,0,0,40,0.72,40,100,0,70,0.6,0,0.4,0,0,0,0,0,0,0,0,0,0,0,0,4.05,0,H-E-B,2.98,5,Dried Fruits and Nuts
75,H-E-B Select Ingredients Dried Fruit Wild Blueberries,0.25,cup,40,0,140,1,0,0,0,0,0,0,0,0,0,0,0,0,0,0,0,0,0,0,0,34,3,27,0,0,0,60,1.44,0,0,150,0,0,0,0,0,0,100,0,0,0,0,0,0,0,21,0,0,0,H-E-B,2.98,2,Dried Fruits and Nuts
76,Snack Factory Fruit Sticks Apple Strawberry,0,,0,0,0,0,0,0,0,0,0,0,0,0,0,0,0,0,0,0,0,0,0,0,0,0,0,0,0,0,0,0,0,0,0,0,0,0,0,0,0,0,0,0,0,0,0,0,0,0,0,0,0,0,H-E-B,3.39,0,Dried Fruits and Nuts
77,Jubes Nata De Coco Strawberry Flavor,0,,0,0,0,0,0,0,0,0,0,0,0,0,0,0,0,0,0,0,0,0,0,0,0,0,0,0,0,0,0,0,0,0,0,0,0,0,0,0,0,0,0,0,0,0,0,0,0,0,0,0,0,0,H-E-B,1.49,0,Dried Fruits and Nuts
78,H-E-B Hit the Trail Mix,0.25,cup,30,0,150,5,0,0,0,0,0,0,0,0,0,0,0,0,0,11,1.5,0,0,0,0,11,2,5,0,0,0,20,1.44,0,0,0,50,0,0,0,0,0,0,0,0,0,0,0,0,0,0,0,0,0,H-E-B,3.99,9,Dried Fruits and Nuts
79,Bare Honey Coconut Chips,0.5,cup,30,0,170,2,0,0,0,0,0,0,0,0,0,0,0,0,0,11,10,0,0,0,0,16,6,10,0,0,0,0,0.72,0,0,0,85,0,0,0,0,0,0,0,0,0,0,0,0,0,1.2,0,0,0,H-E-B,3.79,3,Dried Fruits and Nuts
80,Blue Diamond Bold Wasabi And Soy Sauce Almonds Value Pack,1,oz,28,0,170,6,0,0,0,0,0,0,0,0,0,0,0,0,0,15,1,0,0,0,0,6,3,2,0,0,0,80,1.08,80,0,180,115,0,0,0,0,0,0,0,0,0,0,0,0,0,0,0,9.45,0,H-E-B,8.98,16,Dried Fruits and Nuts
81,H-E-B P.B. and Chocolate Lovers Trail Mix,0.25,cup,31,0,170,4,0,0,0,0,0,0,0,0,0,0,0,0,0,11,3.5,4,2.5,0,0,15,2,10,0,0,0,40,0.72,0,0,135,70,0,0,0,0,0,0,0,0,0,0,0,0,0,0,0,0,0,H-E-B,3.18,9,Dried Fruits and Nuts
82,H-E-B Select Ingredients Halves and Pieces Cashews,1,oz,28,0,170,5,0,0,0,0,0,0,0,0,0,0,0,0,0,13,2.5,7,2.5,0,0,8,1,1,0,0,0,20,1.44,60,150,0,120,1.2,0.5,0.4,0,0,0,0,0,0,0,0,0,0,0,0,0,0,H-E-B,7.98,14,Dried Fruits and Nuts
83,H-E-B Chocolate Nut Crunch Mix,0.25,cup,30,0,150,3,0,0,0,0,0,0,0,0,0,0,0,0,0,9,3,0,0,0,0,16,2,12,0,0,0,20,0.72,0,0,0,15,0,0,0,0,0,0,0,0,0,0,0,0,0,0,0,0,0,H-E-B,3.49,8,Dried Fruits and Nuts
84,H-E-B Dry Roasted Macadamias,0.25,cup,30,0,210,2,0,0,0,0,0,0,0,0,0,0,0,0,0,23,3.5,18,0,0,0,4,2,1,0,0,0,20,0.72,0,0,0,130,0,0,0.9,0,0,0,0.225,0,0,0,0,0,0,0,0,0,0,H-E-B,6.38,6,Dried Fruits and Nuts
85,SunRidge Farms Unsulphured Tropical Fruit Chunks Mix,0,,0,0,0,0,0,0,0,0,0,0,0,0,0,0,0,0,0,0,0,0,0,0,0,0,0,0,0,0,0,0,0,0,0,0,0,0,0,0,0,0,0,0,0,0,0,0,0,0,0,0,0,0,H-E-B,8.99,0,Dried Fruits and Nuts
86,Planters Deluxe Pistachio Mix,1,oz,28,0,160,6,0,0,0,0,0,0,0,0,0,0,0,0,0,13,1.5,7,3.5,0,0,7,3,2,0,0,0,40,1.44,60,100,240,70,0,0.4,0.5,0,0,0,0,0,0,0,0,0,0,0,0,0,0,H-E-B,10.44,14,Dried Fruits and Nuts
87,Woodstock Farms Organic Tequila Lime Pumpkin Seeds,0,,0,0,0,0,0,0,0,0,0,0,0,0,0,0,0,0,0,0,0,0,0,0,0,0,0,0,0,0,0,0,0,0,0,0,0,0,0,0,0,0,0,0,0,0,0,0,0,0,0,0,0,0,H-E-B,8.19,0,Dried Fruits and Nuts
88,SunRidge Farms CocoNo Deluxe Trail Mix,0,,0,0,0,0,0,0,0,0,0,0,0,0,0,0,0,0,0,0,0,0,0,0,0,0,0,0,0,0,0,0,0,0,0,0,0,0,0,0,0,0,0,0,0,0,0,0,0,0,0,0,0,0,H-E-B,5.59,0,Dried Fruits and Nuts
89,H-E-B Organics Mix Nuts  Roasted and Salted,0.25,cups,30,0,180,7,0,0,0,0,0,0,0,0,0,0,0,0,0,15,2,0,0,0,0,6,2,1,0,0,0,40,1.08,0,0,0,45,0,0,0,0,0,0,0,0,0,0,0,0,0,0,0,0,0,H-E-B,6.67,8,Dried Fruits and Nuts
90,Lone Star Nut &amp; Candy Mexicali Fire Mix  sold by the,0,,0,0,0,0,0,0,0,0,0,0,0,0,0,0,0,0,0,0,0,0,0,0,0,0,0,0,0,0,0,0,0,0,0,0,0,0,0,0,0,0,0,0,0,0,0,0,0,0,0,0,0,0,H-E-B,4.99,0,Dried Fruits and Nuts
91,Just Tomatoes  Etc.! Just Veggies,0,,0,0,0,0,0,0,0,0,0,0,0,0,0,0,0,0,0,0,0,0,0,0,0,0,0,0,0,0,0,0,0,0,0,0,0,0,0,0,0,0,0,0,0,0,0,0,0,0,0,0,0,0,H-E-B,4.29,0,Dried Fruits and Nuts
92,H-E-B Organics Dry Roasted Cashews  Unsalted,0.25,cups,30,0,170,5,0,0,0,0,0,0,0,0,0,0,0,0,0,13,2.5,0,0,0,0,10,1,2,0,0,0,20,1.8,0,0,0,0,0,0,0,0,0,0,0,0,0,0,0,0,0,0,0,0,0,H-E-B,5.37,8,Dried Fruits and Nuts
93,Majans Bhuja Bhuja Snacks Crunchy Seasoned Peas,0.5,cup,25,0,100,5,0,0,0,0,0,0,0,0,0,0,0,0,0,4.5,0.5,0,0,0,0,14,2,1,0,0,0,20,0.54,0,0,0,160,0,0,0,0,0,0,0,0,0,0,0,0,0,0.6,0,0,0,H-E-B,3.99,8,Dried Fruits and Nuts
94,H-E-B Trail Mix Hit the Trail With Peanut M&amp;M'S,0,,0,0,0,0,0,0,0,0,0,0,0,0,0,0,0,0,0,0,0,0,0,0,0,0,0,0,0,0,0,0,0,0,0,0,0,0,0,0,0,0,0,0,0,0,0,0,0,0,0,0,0,0,H-E-B,5.98,0,Dried Fruits and Nuts
95,AustiNuts Praline Pecans,0,,0,0,0,0,0,0,0,0,0,0,0,0,0,0,0,0,0,0,0,0,0,0,0,0,0,0,0,0,0,0,0,0,0,0,0,0,0,0,0,0,0,0,0,0,0,0,0,0,0,0,0,0,H-E-B,7.99,0,Dried Fruits and Nuts
96,SunRidge Farms Date Pieces,0,,0,0,0,0,0,0,0,0,0,0,0,0,0,0,0,0,0,0,0,0,0,0,0,0,0,0,0,0,0,0,0,0,0,0,0,0,0,0,0,0,0,0,0,0,0,0,0,0,0,0,0,0,H-E-B,3.49,0,Dried Fruits and Nuts
97,SunRidge Farms Cinnamon Fuji Apple Wedges,0,,0,0,0,0,0,0,0,0,0,0,0,0,0,0,0,0,0,0,0,0,0,0,0,0,0,0,0,0,0,0,0,0,0,0,0,0,0,0,0,0,0,0,0,0,0,0,0,0,0,0,0,0,H-E-B,11.99,0,Dried Fruits and Nuts
98,SunRidge Farms Honey Roasted Peanuts,0,,0,0,0,0,0,0,0,0,0,0,0,0,0,0,0,0,0,0,0,0,0,0,0,0,0,0,0,0,0,0,0,0,0,0,0,0,0,0,0,0,0,0,0,0,0,0,0,0,0,0,0,0,H-E-B,3.99,0,Dried Fruits and Nuts
99,Nichols Farms Organic Roasted Pistachios with Sea Salt,0,,0,0,0,0,0,0,0,0,0,0,0,0,0,0,0,0,0,0,0,0,0,0,0,0,0,0,0,0,0,0,0,0,0,0,0,0,0,0,0,0,0,0,0,0,0,0,0,0,0,0,0,0,H-E-B,5.99,0,Dried Fruits and Nuts
100,Emerald Jalapeno Cashews,0,,0,0,0,0,0,0,0,0,0,0,0,0,0,0,0,0,0,0,0,0,0,0,0,0,0,0,0,0,0,0,0,0,0,0,0,0,0,0,0,0,0,0,0,0,0,0,0,0,0,0,0,0,H-E-B,2.94,0,Dried Fruits and Nuts
101,Margaret Holmes Peanut Patch Green Boiled Peanut,0.25,cup,34,0,100,4,0,0,0,0,0,0,0,0,0,0,0,0,0,8,1.5,0,0,0,0,3,2,0,0,0,0,0,0.36,0,0,0,320,0,0,0,0,0,0,0,0,0,0,0,0,0,0,0,0,0,H-E-B,0.98,6,Dried Fruits and Nuts
102,H-E-B Hit The Trail Trail Mix,1,package,71,0,350,9,0,0,0,0,0,0,0,0,0,0,0,0,0,17,4,9,3.5,0,0,38,3,28,0,0,0,60,1.8,0,0,430,100,0,0,0,0,0,0,0,0,0,0,0,0,0,0,0,0,0,H-E-B,0.99,1,Dried Fruits and Nuts
103,AustiNuts Dry Roasted Smokey Mesquite Cashews,0,,0,0,157,4,0,0,0,0,0,0,0,0,0,0,0,0,0,12,2,0,0,0,0,9,1,2,0,0,0,10,1.62,0,0,0,114,0,0,0,0,0,0,0,0,0,0,0,0,0,0,0,0,0,H-E-B,6.99,0,Dried Fruits and Nuts
104,Bulk Roasted Salted Large Whole Cashews,0,,0,0,0,0,0,0,0,0,0,0,0,0,0,0,0,0,0,0,0,0,0,0,0,0,0,0,0,0,0,0,0,0,0,0,0,0,0,0,0,0,0,0,0,0,0,0,0,0,0,0,0,0,H-E-B,11.99,0,Dried Fruits and Nuts
105,Mariani Whole Natural California Almonds,0,,0,0,0,0,0,0,0,0,0,0,0,0,0,0,0,0,0,0,0,0,0,0,0,0,0,0,0,0,0,0,0,0,0,0,0,0,0,0,0,0,0,0,0,0,0,0,0,0,0,0,0,0,H-E-B,7.98,0,Dried Fruits and Nuts
106,H-E-B Japanix Japanese Style Peanuts,0.25,cup,25,0,120,5,0,0,0,0,0,0,0,0,0,0,0,0,0,7,1,0,0,0,0,11,1,4,0,0,0,20,1.08,0,0,0,115,0,0,0,0,0,0,0,0,0,0,0,0,0,0,0,0,0,H-E-B,1.5,8,Dried Fruits and Nuts
107,Atkins Classic Trail Mix,1,pack,38,0,190,7,0,0,0,0,0,0,0,0,0,0,0,0,0,15,3.5,0,0,0,0,13,4,2,0,0,0,60,1.44,0,0,200,140,0,0,0,0,0,0,0,0,0,0,0,0,0,0,0,0,0,H-E-B,5.78,5,Dried Fruits and Nuts
108,Lance Fresh Salted Peanuts,1,package,39,0,230,9,0,0,0,0,0,0,0,0,0,0,0,0,0,16,3,0,0,0,0,11,5,1,0,0,0,0,0.72,0,0,0,180,0,0,0,0,0,0,0,0,0,0,0,0,0,0,0,0,0,H-E-B,2,1,Dried Fruits and Nuts
109,Planters P3 Portable Protein Original Beef Jerky,1,package,51,0,260,13,0,0,0,0,0,0,0,0,0,0,0,0,0,18,2.5,8,7,0,10,12,3,5,0,0,0,40,1.8,40,150,210,380,1.5,0.4,0.7,14,0,0,0,0,3,0,0,60,0,0,0,10.8,0,H-E-B,4.43,3,Dried Fruits and Nuts
110,H-E-B Mammoth Pecan Halves,0.25,cup,30,0,220,3,0,0,0,0,0,0,0,0,0,0,0,0,0,21,1,0,0,0,0,4,3,1,0,0,0,20,0.72,0,0,0,0,0,0,0,0,0,0,0,0,0,0,0,0,0,1.2,0,0,0,H-E-B,4.99,6,Dried Fruits and Nuts
111,H-E-B Yogurt Raisins,34,pieces,40,0,180,1,0,0,0,0,0,0,0,0,0,0,0,0,0,7,7,0,0,0,0,28,1,25,0,0,0,40,0.36,0,0,0,20,0,0,0,0,0,0,0,0,0,0,0,0,0,0,0,0,0,H-E-B,7.99,16,Dried Fruits and Nuts
112,SunRidge Farms Organic Golden Muscat Raisins,0,,0,0,0,0,0,0,0,0,0,0,0,0,0,0,0,0,0,0,0,0,0,0,0,0,0,0,0,0,0,0,0,0,0,0,0,0,0,0,0,0,0,0,0,0,0,0,0,0,0,0,0,0,H-E-B,4.99,0,Dried Fruits and Nuts
113,SunRidge Farms Chocolate Peanut Caramels,0,,0,0,0,0,0,0,0,0,0,0,0,0,0,0,0,0,0,0,0,0,0,0,0,0,0,0,0,0,0,0,0,0,0,0,0,0,0,0,0,0,0,0,0,0,0,0,0,0,0,0,0,0,H-E-B,6.69,0,Candy
114,SunRidge Farms Crystallized Ginger Chunks,0,,0,0,0,0,0,0,0,0,0,0,0,0,0,0,0,0,0,0,0,0,0,0,0,0,0,0,0,0,0,0,0,0,0,0,0,0,0,0,0,0,0,0,0,0,0,0,0,0,0,0,0,0,H-E-B,5.99,0,Dried Fruits and Nuts
115,Planters P3 Portable Protein Sweet Spicy Teriyaki Jerky,1,package,51,0,250,13,0,0,0,0,0,0,0,0,0,0,0,0,0,17,2,7,6,0,10,12,3,7,0,0,0,20,1.8,40,150,190,450,1.5,0.4,0.6,14,0,0,0,0,3,0,0,60,0,0,0,9.45,0,H-E-B,4.43,3,Dried Fruits and Nuts
116,SunRidge Farms Blend of Enchantment,0,,0,0,0,0,0,0,0,0,0,0,0,0,0,0,0,0,0,0,0,0,0,0,0,0,0,0,0,0,0,0,0,0,0,0,0,0,0,0,0,0,0,0,0,0,0,0,0,0,0,0,0,0,H-E-B,6.99,0,Dried Fruits and Nuts
117,Lone Star Nut &amp; Candy Sweet Cajun Heat Peanuts  sold by the,0,,0,0,0,0,0,0,0,0,0,0,0,0,0,0,0,0,0,0,0,0,0,0,0,0,0,0,0,0,0,0,0,0,0,0,0,0,0,0,0,0,0,0,0,0,0,0,0,0,0,0,0,0,H-E-B,5.49,0,Dried Fruits and Nuts
118,H-E-B Organics Dried Cranberries,0.25,cup,40,0,120,0,0,0,0,0,0,0,0,0,0,0,0,0,0,1,0,0,0,0,0,33,2,26,0,0,0,0,0.36,0,0,0,0,0,0,0,0,0,0,0,0,0,0,0,0,0,0,0,0,0,H-E-B,3.19,4,Dried Fruits and Nuts
119,SunRidge Farms Wasabi Samurai Snack Mix,0,,0,0,0,0,0,0,0,0,0,0,0,0,0,0,0,0,0,0,0,0,0,0,0,0,0,0,0,0,0,0,0,0,0,0,0,0,0,0,0,0,0,0,0,0,0,0,0,0,0,0,0,0,H-E-B,5.99,0,Dried Fruits and Nuts
120,SunRidge Farms Chili Lime Pistachios,0,,0,0,0,0,0,0,0,0,0,0,0,0,0,0,0,0,0,0,0,0,0,0,0,0,0,0,0,0,0,0,0,0,0,0,0,0,0,0,0,0,0,0,0,0,0,0,0,0,0,0,0,0,H-E-B,10.99,0,Dried Fruits and Nuts
121,Sunsweet Pitted Amaz!n Prunes Bite Size,1.5,oz,40,0,100,1,0,0,0,0,0,0,0,0,0,0,0,0,0,0,0,0,0,0,0,26,3,15,0,0,0,20,0.36,0,0,290,0,0,0,0,0,0,300,0,0,0,0,0,0,0,0,0,0,0,H-E-B,3.18,5,Dried Fruits and Nuts
122,Blue Diamond Roasted Salted Almonds Value Pack,1,oz,28,0,170,6,0,0,0,0,0,0,0,0,0,0,0,0,0,16,1,0,0,0,0,5,3,1,0,0,0,80,1.08,80,0,190,85,0,0,0,0,0,0,0,0,0,0,0,0,0,0,0,9.45,0,H-E-B,8.98,16,Dried Fruits and Nuts
123,Japon Dry Roasted Peanuts,0,,0,0,0,0,0,0,0,0,0,0,0,0,0,0,0,0,0,0,0,0,0,0,0,0,0,0,0,0,0,0,0,0,0,0,0,0,0,0,0,0,0,0,0,0,0,0,0,0,0,0,0,0,H-E-B,3.48,0,Dried Fruits and Nuts
124,Stretch Island Fruit Co. Harvest Grape Fruit Strip,1,strip,14,0,45,0,0,0,0,0,0,0,0,0,0,0,0,0,0,0,0,0,0,0,0,12,1,9,0,0,0,0,0,0,0,120,0,0,0,0,0,0,0,0,0,0,0,0,0,0,2.4,0,0,0,H-E-B,0.49,1,Dried Fruits and Nuts
125,Kar's Sweet 'N Salty Mix,1,package,50,0,240,7,0,0,0,0,0,0,0,0,0,0,0,0,0,15,4.5,0,0,0,0,24,2,17,0,0,0,40,1.08,0,0,270,95,0,0,0,0,0,0,0,0,0,0,0,0,0,0,0,0,0,H-E-B,7.48,20,Dried Fruits and Nuts
126,H-E-B Blanched Sliced Almonds,0.25,cup,30,0,180,6,0,0,0,0,0,0,0,0,0,0,0,0,0,15,1,0,0,0,0,6,3,1,0,0,0,80,1.08,0,0,0,0,0,0,0,0,0,0,0,0,0,0,0,0,0,0,0,0,0,H-E-B,5.99,10,Dried Fruits and Nuts
127,Bulk Tamari Roasted Sunflower Seeds,0,,0,0,0,0,0,0,0,0,0,0,0,0,0,0,0,0,0,0,0,0,0,0,0,0,0,0,0,0,0,0,0,0,0,0,0,0,0,0,0,0,0,0,0,0,0,0,0,0,0,0,0,0,H-E-B,3.49,0,Dried Fruits and Nuts
128,Lone Star Nut &amp; Candy Houston Blend  sold by the,0,,0,0,0,0,0,0,0,0,0,0,0,0,0,0,0,0,0,0,0,0,0,0,0,0,0,0,0,0,0,0,0,0,0,0,0,0,0,0,0,0,0,0,0,0,0,0,0,0,0,0,0,0,H-E-B,6.49,0,Dried Fruits and Nuts
129,Brothers All Natural Strawberry Banana Freeze-Dried Fruit Crisps,1,bag,12,0,45,1,0,0,0,0,0,0,0,0,0,0,0,0,0,0,0,0,0,0,0,10,2,6,0,0,0,0,0.36,0,0,0,0,0,0,0,0,0,100,0,0,0,0,0,0,0,15,0,0,0,H-E-B,0.88,0,Dried Fruits and Nuts
130,Hill Country Fare Roasted and Salted Peanuts,0.25,cup,28,0,170,8,0,0,0,0,0,0,0,0,0,0,0,0,0,15,2.5,7,4.5,0,0,4,3,1,0,0,0,20,0.36,0,0,210,90,0,0,0,0,0,0,0,0,0,0,0,0,0,0,0,0,0,H-E-B,1,4,Dried Fruits and Nuts
131,SunRidge Farms Carob Almonds,0,,0,0,0,0,0,0,0,0,0,0,0,0,0,0,0,0,0,0,0,0,0,0,0,0,0,0,0,0,0,0,0,0,0,0,0,0,0,0,0,0,0,0,0,0,0,0,0,0,0,0,0,0,H-E-B,6.99,0,Dried Fruits and Nuts
